{
  "schemaVersion": "0.3-draft",
  "model": {
    "schemaVersion": "0.4-draft",
    "id": "order-system",
    "title": "Order system across levels",
    "scope": {
      "timeframe": "current",
      "environment": "Fictional production snapshot",
      "snapshot": "Fixture v1 — 2026-09-08",
      "coverage": "partial",
      "question": "How does the overview correspond to the service internals?",
      "includes": [
        "Only the explicitly listed components and operations."
      ],
      "excludes": [
        "Replicas, network topology, and unrecorded behavior."
      ],
      "abstraction": "A partial model with two explicitly connected abstraction levels."
    },
    "sources": [
      {
        "id": "fictional-snapshot",
        "kind": "fixture",
        "locator": "evidence.md",
        "description": "Invented scenario for testing known, unknown, and disputed boundary mappings."
      }
    ],
    "perspectives": [],
    "entities": [
      {
        "id": "checkout",
        "label": "Checkout",
        "existence": {
          "status": "established",
          "value": true,
          "basis": {
            "sourceRefs": [
              "fictional-snapshot"
            ],
            "explanation": "Explicitly stipulated by this fictional test scenario, not extracted from a real organization."
          }
        },
        "category": {
          "status": "established",
          "value": "service",
          "basis": {
            "sourceRefs": [
              "fictional-snapshot"
            ],
            "explanation": "Explicitly stipulated by this fictional test scenario, not extracted from a real organization."
          }
        },
        "abstraction": {
          "represents": {
            "status": "established",
            "value": "Checkout in the fictional order system.",
            "basis": {
              "sourceRefs": [
                "fictional-snapshot"
              ],
              "explanation": "Explicitly stipulated by this fictional test scenario, not extracted from a real organization."
            }
          },
          "omits": [
            "Deployment replicas and implementation classes."
          ],
          "reason": "Show responsibilities at this graph level."
        }
      },
      {
        "id": "orders",
        "label": "Order Processing",
        "existence": {
          "status": "established",
          "value": true,
          "basis": {
            "sourceRefs": [
              "fictional-snapshot"
            ],
            "explanation": "Explicitly stipulated by this fictional test scenario, not extracted from a real organization."
          }
        },
        "category": {
          "status": "established",
          "value": "service",
          "basis": {
            "sourceRefs": [
              "fictional-snapshot"
            ],
            "explanation": "Explicitly stipulated by this fictional test scenario, not extracted from a real organization."
          }
        },
        "abstraction": {
          "represents": {
            "status": "established",
            "value": "Order Processing in the fictional order system.",
            "basis": {
              "sourceRefs": [
                "fictional-snapshot"
              ],
              "explanation": "Explicitly stipulated by this fictional test scenario, not extracted from a real organization."
            }
          },
          "omits": [
            "Deployment replicas and implementation classes."
          ],
          "reason": "Show responsibilities at this graph level."
        }
      },
      {
        "id": "payments",
        "label": "Payment Provider",
        "existence": {
          "status": "established",
          "value": true,
          "basis": {
            "sourceRefs": [
              "fictional-snapshot"
            ],
            "explanation": "Explicitly stipulated by this fictional test scenario, not extracted from a real organization."
          }
        },
        "category": {
          "status": "established",
          "value": "service",
          "basis": {
            "sourceRefs": [
              "fictional-snapshot"
            ],
            "explanation": "Explicitly stipulated by this fictional test scenario, not extracted from a real organization."
          }
        },
        "abstraction": {
          "represents": {
            "status": "established",
            "value": "Payment Provider in the fictional order system.",
            "basis": {
              "sourceRefs": [
                "fictional-snapshot"
              ],
              "explanation": "Explicitly stipulated by this fictional test scenario, not extracted from a real organization."
            }
          },
          "omits": [
            "Deployment replicas and implementation classes."
          ],
          "reason": "Show responsibilities at this graph level."
        }
      },
      {
        "id": "operations",
        "label": "Operations Console",
        "existence": {
          "status": "established",
          "value": true,
          "basis": {
            "sourceRefs": [
              "fictional-snapshot"
            ],
            "explanation": "Explicitly stipulated by this fictional test scenario, not extracted from a real organization."
          }
        },
        "category": {
          "status": "established",
          "value": "actor",
          "basis": {
            "sourceRefs": [
              "fictional-snapshot"
            ],
            "explanation": "Explicitly stipulated by this fictional test scenario, not extracted from a real organization."
          }
        },
        "abstraction": {
          "represents": {
            "status": "established",
            "value": "Operations Console in the fictional order system.",
            "basis": {
              "sourceRefs": [
                "fictional-snapshot"
              ],
              "explanation": "Explicitly stipulated by this fictional test scenario, not extracted from a real organization."
            }
          },
          "omits": [
            "Deployment replicas and implementation classes."
          ],
          "reason": "Show responsibilities at this graph level."
        }
      },
      {
        "id": "order-api",
        "label": "Order API",
        "existence": {
          "status": "established",
          "value": true,
          "basis": {
            "sourceRefs": [
              "fictional-snapshot"
            ],
            "explanation": "Explicitly stipulated by this fictional test scenario, not extracted from a real organization."
          }
        },
        "category": {
          "status": "established",
          "value": "service",
          "basis": {
            "sourceRefs": [
              "fictional-snapshot"
            ],
            "explanation": "Explicitly stipulated by this fictional test scenario, not extracted from a real organization."
          }
        },
        "abstraction": {
          "represents": {
            "status": "established",
            "value": "Order API in the fictional order system.",
            "basis": {
              "sourceRefs": [
                "fictional-snapshot"
              ],
              "explanation": "Explicitly stipulated by this fictional test scenario, not extracted from a real organization."
            }
          },
          "omits": [
            "Deployment replicas and implementation classes."
          ],
          "reason": "Show responsibilities at this graph level."
        }
      },
      {
        "id": "queue",
        "label": "Order Queue",
        "existence": {
          "status": "established",
          "value": true,
          "basis": {
            "sourceRefs": [
              "fictional-snapshot"
            ],
            "explanation": "Explicitly stipulated by this fictional test scenario, not extracted from a real organization."
          }
        },
        "category": {
          "status": "established",
          "value": "queue",
          "basis": {
            "sourceRefs": [
              "fictional-snapshot"
            ],
            "explanation": "Explicitly stipulated by this fictional test scenario, not extracted from a real organization."
          }
        },
        "abstraction": {
          "represents": {
            "status": "established",
            "value": "Order Queue in the fictional order system.",
            "basis": {
              "sourceRefs": [
                "fictional-snapshot"
              ],
              "explanation": "Explicitly stipulated by this fictional test scenario, not extracted from a real organization."
            }
          },
          "omits": [
            "Deployment replicas and implementation classes."
          ],
          "reason": "Show responsibilities at this graph level."
        }
      },
      {
        "id": "worker",
        "label": "Order Worker",
        "existence": {
          "status": "established",
          "value": true,
          "basis": {
            "sourceRefs": [
              "fictional-snapshot"
            ],
            "explanation": "Explicitly stipulated by this fictional test scenario, not extracted from a real organization."
          }
        },
        "category": {
          "status": "established",
          "value": "service",
          "basis": {
            "sourceRefs": [
              "fictional-snapshot"
            ],
            "explanation": "Explicitly stipulated by this fictional test scenario, not extracted from a real organization."
          }
        },
        "abstraction": {
          "represents": {
            "status": "established",
            "value": "Order Worker in the fictional order system.",
            "basis": {
              "sourceRefs": [
                "fictional-snapshot"
              ],